{
 "$schema": "https://aij.eddy3d.com/api/3.5.0/schemas/points.schema.json",
 "schema_version": "2.5.0",
 "data_version": "249fe518ae281d3b62ab76162a59a358bd385e88e01e94305f4ab90414920c75",
 "license": "CC-BY-4.0",
 "case": "G",
 "title": "Case G — flow behind a tree belt",
 "points_source": "clean/cases/G/points.csv",
 "units": {
  "length": "m (full scale)",
  "velocity_ratio": "dimensionless, U/UH",
  "k_ratio": "dimensionless, k/UH^2"
 },
 "frame": {
  "origin": "the leeward face of the tree belt at ground level, on the vertical section through the belt's centre",
  "x": "+x downwind: the belt occupies x in [-2, 0] m, the measurement lines lie behind it at x = 1.75 ... 35 m",
  "y": "+y along the belt (y in [-37, 37] m); every point is on y = 0",
  "z": "+z up; the belt spans z in [1.2, 7] m; points at z = 1.5, 3, 4.5, 6 m",
  "wind_direction_rotation": "one direction, toward +x (perpendicular to the belt); the field wind's angle to the belt normal is not published",
  "lateral_sign_applied": 1,
  "coordinate_scale_applied": 1.0
 },
 "columns": [
  "point_id",
  "config",
  "instrument",
  "wind_direction_deg",
  "x",
  "y",
  "z",
  "velocity_ratio",
  "campaign",
  "k_ratio"
 ],
 "column_meaning": {
  "point_id": "the tunnel's own measurement point number",
  "config": "configuration key: 'default', Case C centre building '0D'/'1D'/'2D', Case E state 'bc' (before) / 'ac' (after construction)",
  "instrument": "'split_fibre' (vector components) or 'thermistor' (omnidirectional scalar speed)",
  "wind_direction_deg": "AIJ wind direction in degrees; 0 is the case's reference direction (see frame)",
  "x": "m, case frame",
  "y": "m, case frame",
  "z": "m above ground, case frame",
  "velocity_ratio": "dimensionless, mean speed over the case's reference speed (Case E: Vs / U(15.9 m), U(15.9 m) = 3.935 m/s; see the case's normalisation)",
  "campaign": "'wind_tunnel' (model scale) or 'field' (a full-scale observation: Cases F, G, M)",
  "k_ratio": "k / U_ref^2 where the dataset publishes only normalised values (Case G; U_ref = U at the tree height)"
 },
 "n": 28,
 "csv": {
  "url": "https://aij.eddy3d.com/api/3.5.0/cases/G/points.csv?v=914883bf7fec",
  "path": "cases/G/points.csv",
  "media_type": "text/csv",
  "bytes": 2246,
  "sha256": "914883bf7fec7e7c3a0345a57694b2b14edf34e6d2786e9083b9459fe4737e19"
 },
 "points": [
  {
   "point_id": 1,
   "config": "default",
   "instrument": "sonic_anemometer",
   "wind_direction_deg": 0.0,
   "x": 1.75,
   "y": 0.0,
   "z": 1.5,
   "velocity_ratio": 0.3864835199,
   "campaign": "field",
   "k_ratio": 0.01092180369
  },
  {
   "point_id": 2,
   "config": "default",
   "instrument": "sonic_anemometer",
   "wind_direction_deg": 0.0,
   "x": 1.75,
   "y": 0.0,
   "z": 3.0,
   "velocity_ratio": 0.5473707249,
   "campaign": "field",
   "k_ratio": 0.02055301521
  },
  {
   "point_id": 3,
   "config": "default",
   "instrument": "sonic_anemometer",
   "wind_direction_deg": 0.0,
   "x": 1.75,
   "y": 0.0,
   "z": 4.5,
   "velocity_ratio": 0.6002162212,
   "campaign": "field",
   "k_ratio": 0.02567388957
  },
  {
   "point_id": 4,
   "config": "default",
   "instrument": "sonic_anemometer",
   "wind_direction_deg": 0.0,
   "x": 1.75,
   "y": 0.0,
   "z": 6.0,
   "velocity_ratio": 0.4615884847,
   "campaign": "field",
   "k_ratio": 0.02617121294
  },
  {
   "point_id": 5,
   "config": "default",
   "instrument": "sonic_anemometer",
   "wind_direction_deg": 0.0,
   "x": 3.5,
   "y": 0.0,
   "z": 1.5,
   "velocity_ratio": 0.4120026988,
   "campaign": "field",
   "k_ratio": 0.01340689497
  },
  {
   "point_id": 6,
   "config": "default",
   "instrument": "sonic_anemometer",
   "wind_direction_deg": 0.0,
   "x": 3.5,
   "y": 0.0,
   "z": 3.0,
   "velocity_ratio": 0.4554699349,
   "campaign": "field",
   "k_ratio": 0.01628692776
  },
  {
   "point_id": 7,
   "config": "default",
   "instrument": "sonic_anemometer",
   "wind_direction_deg": 0.0,
   "x": 3.5,
   "y": 0.0,
   "z": 4.5,
   "velocity_ratio": 0.4876378826,
   "campaign": "field",
   "k_ratio": 0.02549541368
  },
  {
   "point_id": 8,
   "config": "default",
   "instrument": "sonic_anemometer",
   "wind_direction_deg": 0.0,
   "x": 3.5,
   "y": 0.0,
   "z": 6.0,
   "velocity_ratio": 0.4941105769,
   "campaign": "field",
   "k_ratio": 0.02457538201
  },
  {
   "point_id": 9,
   "config": "default",
   "instrument": "sonic_anemometer",
   "wind_direction_deg": 0.0,
   "x": 7.0,
   "y": 0.0,
   "z": 1.5,
   "velocity_ratio": 0.4753103932,
   "campaign": "field",
   "k_ratio": 0.01565446694
  },
  {
   "point_id": 10,
   "config": "default",
   "instrument": "sonic_anemometer",
   "wind_direction_deg": 0.0,
   "x": 7.0,
   "y": 0.0,
   "z": 3.0,
   "velocity_ratio": 0.4027303937,
   "campaign": "field",
   "k_ratio": 0.01382856392
  },
  {
   "point_id": 11,
   "config": "default",
   "instrument": "sonic_anemometer",
   "wind_direction_deg": 0.0,
   "x": 7.0,
   "y": 0.0,
   "z": 4.5,
   "velocity_ratio": 0.4044039696,
   "campaign": "field",
   "k_ratio": 0.0139886831
  },
  {
   "point_id": 12,
   "config": "default",
   "instrument": "sonic_anemometer",
   "wind_direction_deg": 0.0,
   "x": 7.0,
   "y": 0.0,
   "z": 6.0,
   "velocity_ratio": 0.4569609337,
   "campaign": "field",
   "k_ratio": 0.02662867582
  },
  {
   "point_id": 13,
   "config": "default",
   "instrument": "sonic_anemometer",
   "wind_direction_deg": 0.0,
   "x": 14.0,
   "y": 0.0,
   "z": 1.5,
   "velocity_ratio": 0.5212432587,
   "campaign": "field",
   "k_ratio": 0.0204806323
  },
  {
   "point_id": 14,
   "config": "default",
   "instrument": "sonic_anemometer",
   "wind_direction_deg": 0.0,
   "x": 14.0,
   "y": 0.0,
   "z": 3.0,
   "velocity_ratio": 0.4081028622,
   "campaign": "field",
   "k_ratio": 0.01491531585
  },
  {
   "point_id": 15,
   "config": "default",
   "instrument": "sonic_anemometer",
   "wind_direction_deg": 0.0,
   "x": 14.0,
   "y": 0.0,
   "z": 4.5,
   "velocity_ratio": 0.3864805172,
   "campaign": "field",
   "k_ratio": 0.01776328561
  },
  {
   "point_id": 16,
   "config": "default",
   "instrument": "sonic_anemometer",
   "wind_direction_deg": 0.0,
   "x": 14.0,
   "y": 0.0,
   "z": 6.0,
   "velocity_ratio": 0.4631720038,
   "campaign": "field",
   "k_ratio": 0.03413445388
  },
  {
   "point_id": 17,
   "config": "default",
   "instrument": "sonic_anemometer",
   "wind_direction_deg": 0.0,
   "x": 21.0,
   "y": 0.0,
   "z": 1.5,
   "velocity_ratio": 0.5334423282,
   "campaign": "field",
   "k_ratio": 0.0369808908
  },
  {
   "point_id": 18,
   "config": "default",
   "instrument": "sonic_anemometer",
   "wind_direction_deg": 0.0,
   "x": 21.0,
   "y": 0.0,
   "z": 3.0,
   "velocity_ratio": 0.4506586752,
   "campaign": "field",
   "k_ratio": 0.03125956129
  },
  {
   "point_id": 19,
   "config": "default",
   "instrument": "sonic_anemometer",
   "wind_direction_deg": 0.0,
   "x": 21.0,
   "y": 0.0,
   "z": 4.5,
   "velocity_ratio": 0.4491353303,
   "campaign": "field",
   "k_ratio": 0.03735445118
  },
  {
   "point_id": 20,
   "config": "default",
   "instrument": "sonic_anemometer",
   "wind_direction_deg": 0.0,
   "x": 21.0,
   "y": 0.0,
   "z": 6.0,
   "velocity_ratio": 0.526208848,
   "campaign": "field",
   "k_ratio": 0.05180477546
  },
  {
   "point_id": 21,
   "config": "default",
   "instrument": "sonic_anemometer",
   "wind_direction_deg": 0.0,
   "x": 28.0,
   "y": 0.0,
   "z": 1.5,
   "velocity_ratio": 0.5004211141,
   "campaign": "field",
   "k_ratio": 0.03429135657
  },
  {
   "point_id": 22,
   "config": "default",
   "instrument": "sonic_anemometer",
   "wind_direction_deg": 0.0,
   "x": 28.0,
   "y": 0.0,
   "z": 3.0,
   "velocity_ratio": 0.4657591494,
   "campaign": "field",
   "k_ratio": 0.03294245905
  },
  {
   "point_id": 23,
   "config": "default",
   "instrument": "sonic_anemometer",
   "wind_direction_deg": 0.0,
   "x": 28.0,
   "y": 0.0,
   "z": 4.5,
   "velocity_ratio": 0.4916987451,
   "campaign": "field",
   "k_ratio": 0.04443248427
  },
  {
   "point_id": 24,
   "config": "default",
   "instrument": "sonic_anemometer",
   "wind_direction_deg": 0.0,
   "x": 28.0,
   "y": 0.0,
   "z": 6.0,
   "velocity_ratio": 0.5820683772,
   "campaign": "field",
   "k_ratio": 0.06898849631
  },
  {
   "point_id": 25,
   "config": "default",
   "instrument": "sonic_anemometer",
   "wind_direction_deg": 0.0,
   "x": 35.0,
   "y": 0.0,
   "z": 1.5,
   "velocity_ratio": 0.4726795497,
   "campaign": "field",
   "k_ratio": 0.04043046731
  },
  {
   "point_id": 26,
   "config": "default",
   "instrument": "sonic_anemometer",
   "wind_direction_deg": 0.0,
   "x": 35.0,
   "y": 0.0,
   "z": 3.0,
   "velocity_ratio": 0.4622149305,
   "campaign": "field",
   "k_ratio": 0.0427602653
  },
  {
   "point_id": 27,
   "config": "default",
   "instrument": "sonic_anemometer",
   "wind_direction_deg": 0.0,
   "x": 35.0,
   "y": 0.0,
   "z": 4.5,
   "velocity_ratio": 0.4952582178,
   "campaign": "field",
   "k_ratio": 0.05429380498
  },
  {
   "point_id": 28,
   "config": "default",
   "instrument": "sonic_anemometer",
   "wind_direction_deg": 0.0,
   "x": 35.0,
   "y": 0.0,
   "z": 6.0,
   "velocity_ratio": 0.5861690781,
   "campaign": "field",
   "k_ratio": 0.07240613259
  }
 ]
}
